Type,A,B
RA,That's why it makes sense that the bachelor thesis only makes up a relatively small portion of the final grade (15 out of 120 credits).,"This is also more akin to the real working world later, where performance isn't singular, but constant and has to be delivered over longer periods."
RA,Berlin's basketball team has just come out of a sobering season.,Especially the home games have seen the team stay behind expectations.
RA,For safety reasons alone I find continued operation wrong.,I think Berlin with its two inner-city airports was lucky not having to experience an airplane catastrophe for decades.
RA,"so that using Tempelhofer Feld, which offers a lot of open space and is currently hardly developed, as living space is a sensible idea.","For years there has been a housing shortage in Berlin,"
RA,"Admittedly they do not generally prevent you from catching a virus,",since they can only react to publicly known threats.
RA,Germany should by no means introduce capital punishment.,"If there were capital punishment, this would mean people are allowed to put themselves above others and rule over their lives."
RA,The morning-after pill ought to be available over-the-counter in pharmacies.,Even with state-of-the-art contraceptives there can be mistakes and problems
CA,Secret services must be more tightly regulated in order to prevent excessive surveillance.,Parliamentary control however hampers the work of intelligence services
RA,The death penalty is a legal means that as such is not practicable in Germany.,"For one thing, inviolable human dignity is anchored in our constitution,"
RA,We should thus all limit our consumption of meat rigorously.,"Furthermore, the production of meat is comparably resource-intensive."
RA,The death penalty should be abandoned everywhere.,Moreover it turns out time and again that innocent people are also convicted and executed.
RA,"No, the retirement age should be raised to 65 again.",And we'd have to offer more leisure activities for seniors.
RA,"Especially now, as there is a lack of skilled labour, it's irresponsible for the economy and prosperity to retire at 63.",Only the question remains whether this early 'leisure' will be nicer if you have no idea what do to all day and you statistically still have almost 20 (!!!) years to go?
CA,Increasing penalties is therefore the right way.,"A fine for leaving dog waste behind admittedly seems rather authoritarian,"
RA,With those kinds of amounts you think twice about whether you really want to stay in the flat.,"If there must be rent increases, there should also be a cap to avoid nasty surprises."
RA,There should be a higher fine for dog dirt on the pavement.,"Also children, adults and other animals aren't allowed to leave droppings on the pavement."
CA,We should thus all limit our consumption of meat rigorously.,One could worry that our farmers would then run into economic difficulties.
RA,"This helps the landlords,",With those kinds of amounts you think twice about whether you really want to stay in the flat.
RA,computer games should also not be recognized as Olympic events.,Olympic events are rooted in old traditions.
RA,which is why students also ought to be involved in this cost factor.,"Quality at universities has its price,"
CA,"Still, the state needs the death penalty as a deterrent to horrific crimes.","Capital punishment is not a solution,"
CA,Tax data that are not made available for free should therefore not be acquired by the state.,Those who do or try to should be held accountable if at all possible.
RA,Increasing penalties is therefore the right way.,Pieces of dog poo on the pavements are a real danger.
RA,Supermarkets and shopping centres should be allowed to open on any Sundays and holidays.,"Considering the growing digitization of society, the traditional model of the weekend will soon be obsolete."
RA,A reduction in the amount of chemically produced medication per person is most certainly desirable.,"From time immemorial humans have had complementary medicine,"
RA,"No, the retirement age should be raised to 65 again.",Without them we'd forgo a great deal of collected experience.
RA,It was clearly a mistake to include Tom in our football team.,But the worst thing is his habit of always complaining to the referee.
RA,"Especially now, as there is a lack of skilled labour, it's irresponsible for the economy and prosperity to retire at 63.","Also, one isn't taking responsibility for society if one gives up one's experienced, healthy and highly qualified capabilities earlier than necessary for private/personal reasons."
CA,Therefore universities should not charge tuition fees in Germany.,which is why students also ought to be involved in this cost factor.
RA,Today I will delete my Facebook account.,Not only because I'm constantly astonished about who wants to be my friend.
CA,"A simply designed practical outfit would even out the overall visual image of a school, and direct attention towards the character and achievements of the students - and not their buying power.","Some may find the idea of a school uniform anachronistic,"
RA,"A bank bailout is very, very costly.","For instance, the taxpayer stood in for the failed bank 'Hypo Real Estate' with a three-figure billion amount."
RA,The TV license fee should only be collected from those who actually make use of the programming of the public broadcasters.,"Yet the fees are demanded from everybody who does not apply for a waiver, no matter how many receiver devices actually exist in the household and how they are being used."
RA,Peter should close his snack bar as soon as possible.,"Pricing pressures are just too high,"
RA,Current regulations for the calculation of the total grade should therefore be maintained.,Adjusting the portion of the total grade upwards anyway would not be commensurate to other study assignments and examinations.
RA,A reduction in the amount of chemically produced medication per person is most certainly desirable.,and it has not generally been ineffective.
RA,That's why the statutory health insurance companies should not cover such treatments.,which means that quacks and phonies can practice these occupations unknown to the patients.
CA,you should buy IBM shares if you want to invest.,"Although IBM's numbers haven't been staggering recently,"
RA,"Actually only those people should pay a TV & radio licence fee who really watch ARD, ZDF, Arte etc.","What are you paying for, then? That the same actors time and again get to have a laugh at exotic shooting locations?"
CA,"Nevertheless the head of government, Merkel, had better restrain herself in announcing handouts this year.",and traditionally the governing party is generous with popular promises in the run-up to federal elections.
RA,School uniforms should be introduced in our schools again.,which may reduce discrimination of financially and/or socially disadvantaged children.
RA,The health insurance companies ought to be enabled to recognize a doctor's decision for natural treatment and also to cover it.,Often natural treatments do not put as much of a strain on the patient.
CA,The TV/radio licence fee can only be required of all citizens/households equally.,Critics point out that they are not using what's on offer by public broadcasting.
RA,The state ought to prevent murder - not avenge it.,A re-introduction of capital punishment in Germany would be a step back into the Middle Ages.
RA,Tomorrow I will skydive for the first time in my life.,But I want to experience this incredible moment of freedom that skydivers report time and again.
RA,The TV/radio licence fee can only be required of all citizens/households equally.,"Just as with other choices in culture or infrastructure, public broadcasters are also to be financed, regardless of whether individuals make use of their programming or not."
RA,"One should not re-introduce capital punishment in Germany,",Capital punishment will not deter anyone else from an atrocity.
RA,Germany should by no means introduce capital punishment.,Capital punishment would be murder and would have to be punished with the death penalty itself.
RA,Thus one of his ex-girlfriends must have been there.,When he got back from Ralf's party last night he was still stone-cold sober.
RA,There should be a higher fine for dog dirt on the pavement.,"If you dispose of the waste then and there yourself, no fine is necessary."
RA,That's why we should not allow any additional bank rescues.,"A bank bailout is very, very costly."
CA,"Intelligence services should be more closely regulated by parliament,","Yet it remains questionable whether the actual implementation of such supervision would at the same time lead to a stronger observance of laws,"
CA,They should not be spent on personal preferences without proven use.,The choice of an attending physician is at the discretion of the patient.
RA,That's why Germany should not introduce capital punishment!,Courts are also subject to human error.
CA,Supermarkets and shopping centres should be allowed to open on any Sundays and holidays.,This may be a change for the employees that cannot to be implemented easily.
RA,Secret services must be more tightly regulated in order to prevent excessive surveillance.,"Besides, intelligence services intervene massively in the privacy of citizens"
RA,It is quite clear that Sunday should remain a day of rest.,"Thus Sundays should remain a day for getting together with family,"
RA,Especially the home games have seen the team stay behind expectations.,A sad highlight: Losing 60:87 to the weakish Mannheimers in a sold-out stadium.
CA,Rent prices should be limited by a cap when there's a change of tenant.,"Landlords may want to earn as much as possible,"
RA,Therefore no unproven and unrecognized treatments by naturopaths should be reimbursed by the insurance companies.,The effectiveness of many natural remedies has not been demonstrated.
RA,Today I will delete my Facebook account.,I'm also tired of my data boosting the market value of that corporation.
RA,Actually it would be justified if all German universities charged tuition fees.,"Those who study later decide this early on, anyway."
RA,The negative impact of air traffic however is considerable.,"Particularly in Tegel, the residents have been bearing the stress of aircraft noise for decades."
RA,"Considering what's on television these days, it would be appropriate to only have those people pay who actually (want to) follow the programming.","In some cases there are only shows for older generations on at prime times, so why then should everyone pay for this?"
RA,For these reasons supermarkets and shopping centres should not be allowed to be open for business on arbitrary Sundays and holidays.,"On top of that, private and family life suffers massively because of this reduction and shifting in designated off-times."
RA,I am not of the opinion that the retirement age should be set at 63 years.,This would mean that organizations would be lacking a great deal of manpower in the future.
CA,We Berliners should take the chance and become pioneers in waste separation!,"Yes, it's annoying and cumbersome to separate your rubbish properly all the time."
RA,"This is why we need more police presence in public transport,",Passengers would definitely feel safer then.
RA,We should thus all limit our consumption of meat rigorously.,Excessive consumption of meat is unhealthy.
CA,One could worry that our farmers would then run into economic difficulties.,"However, no serious economist has confirmed this prediction to date."
RA,And he always chickens out when things get dicey.,"Yesterday, when the bouncer wouldn't let us in, he was suddenly gone."
RA,School uniforms should be introduced in our schools again.,"Furthermore, it would facilitate the finding of truants, who may wish to get away with fewer classes at school."
RA,These areas will be upgraded economically due to these factors (housing health and employment).,Closing down Tegel will have health benefits for hundreds of thousands in the approach path.
CA,School uniforms should be introduced in our schools again.,Uniforms always and immediately provoke fear of losing one's individuality
RA,"Alternative treatments should be subsidized in the same way as conventional treatments,","since both methods can lead to the prevention, mitigation or cure of an illness."
CA,Ralf does insist that they drank advocaat together.,But even without an ex-girlfriend he would never touch that.
CA,That's why a visit to the doctor and professional advice should remain mandatory.,Of course it would be nice and simple if after a fun night out with a party acquaintance you could simply take the 'morning-after pill' and feel at ease.
RA,The performance often required by players is considerable and by all means comparable to physical efforts.,"Various skills are promoted and required by different games,"
RA,"as too much TV makes you stupid in the long run,",like your brother.
RA,as they have more pull in the end anyway.,"they’re very bad however, if the rent suddenly climbs by €100 or €200."
CA,"BER should be re-conceptualized from scratch,",and this would delay the date of completion indefinitely.
RA,Our society is in danger of overheating due to 'never clocking off'.,the last 20 years have seen the Sunday off work increasingly sacrificed to commerce.
CA,Today I will delete my Facebook account.,Facebook warns me emphatically that I may lose contact with my friends.
RA,This results in a lack of alertness in the road traffic comparable to a minor offense of the traffic regulations.,"Dog dirt on the pavement requires my complete, ground-focused attention on my way to work."
CA,A cap on rent increases upon tenant change is therefore not to be supported.,"Even if one might think that additional rent control is needed besides the current tenant protection,"
RA,"I find the peripheral housing development at Tempelhofer Feld right for urban planning reasons,",The size of the field allows for both housing and generous open space.
RA,The anticipated objectives of tuition fees can be achieved by other means.,There are other instruments to motivate tighter discipline while studying.
RA,you should buy IBM shares if you want to invest.,"Because for one thing, their products will still sell in bad times,"
RA,"A fixing of rent prices according to the market alone, however, will lead to a further division of society.",The rich and poor live in different neighbourhoods.
RA,"The steering system may still need a bit of tweaking,",and surely you'll want to be speeding a lot with that beauty.
RA,Tuition fees should not be charged in Germany.,That's costly!
RA,which means that quacks and phonies can practice these occupations unknown to the patients.,"Besides many practices in this field are not regulated professions,"
RA,Stepping in dog dirt is gross and absolutely ruins your day,"due to the dirt, the stench and the often considerable effort to get rid of it."
RA,"Considering the growing digitization of society, the traditional model of the weekend will soon be obsolete.","Many European countries, for instance the Netherlands, Sweden and Great Britain, have already understood this and successfully adjusted the opening hours for retailers."
CA,It would be fair to make them into an Olympic event.,"Perhaps it is less thrilling for a spectator than for the player,"
RA,We urgently need a midfield replacement for the coming match.,And a young substitute always invigorates the team.
RA,"This is why we need more police presence in public transport,",Also the rules of the public transportation services are rarely observed.
RA,We don't need it.,Plus we don't live in medieval times anymore.
RA,"With a BA dissertation one can, however, demonstrate interests and subject matter expertise particularly well.",After all one doesn't excel in every subject.
RA,Voters have become more sceptical.,Too many promises have not been kept.
CA,I can only recommend the new smartphone XYZ-123 to everyone.,"Of course the camera could be better,"
CA,Health insurance companies should not cover treatment in complementary medicine,unless the promised effect and its medical benefit have been concretely proven.
RA,No one should have the possibility to pick up the morning-after pill over the counter at the pharmacy.,Furthermore there's the risk that women could use the over-the-counter morning-after pill as a substitute for contraception.
RA,Rent prices should be limited by a cap when there's a change of tenant.,Gentrification destroys entire districts and their culture.
RA,"BER should be re-conceptualized from scratch,",Both the drawn-out building operations and the mounting safety issues show clear shortcomings in the entire planning.
RA,the statutory retirement age should in the future not remain at 63 years.,"For, due to the low birth rate, the proportion of the elderly population and with it pension costs are on the rise,"
RA,It would be fair to make them into an Olympic event.,"Plus the hurdle to make video games Olympic events is minimal,"
RA,The introductory phase of retirement at 63 would also be a particular challenge,The danger here is that experienced junior staff is not available in sufficient numbers.
RA,Due to the many random factors the bachelor thesis should not play a bigger role.,"If this carries more weight, many good individual assignments done during the course of study may be obscured."
RA,Particularly the younger generations are no longer dependent on the programming of public broadcasters.,"US series are preferred over “Tatort”,"
CA,It is unfair and unjustifiable that new tenants have to pay a much higher rent than previous residents.,Clearly the landlord has to pay for some repairs before a new lease.
CA,Opening on Sundays and holidays would therefore help both customers and shops.,"Owner-run shops may potentially be overwhelmed by additional work times on Sundays and holidays,"
RA,"Of course the camera could be better,",and images in dark surroundings are often snowy.
RA,"Criminals should not be put in luxury prisons, though.","After all there are criminals who enjoy 'living' in prison for its decent board, no taxes to be paid, no stress with work."
RA,"as long as the motivation of those people isn't triggered by propaganda, corruption and military pressure.","Since, however, in Russia besides gas and oil only propaganda and corruption rule,"
RA,the EU should intervene right away.,A violation of international law should be more than enough to consider a reaction!
RA,The negative impact of air traffic however is considerable.,Air traffic is extremely environmentally unfriendly.
CA,"A bank bailout is very, very costly.",The politicians are trying to appease us with the fact that actually only a tiny amount of all that money was really spent.
CA,My parents say this could also be pure coincidence.,But that much of a coincidence is simply impossible.
RA,That's why Germany should not introduce capital punishment!,No human being or human committee should again be given the permission to rule over 'life or death'.
RA,Never have there been longer queues at the advance ticket offices,– in Japan there was one exceeding 3.2km –
CA,everyone should chip in.,Admittedly trash and turmoil are exactly what the majority of people want to see.
RA,Also streets and shops would presumably be emptier,as not everyone would be open on the same day.
CA,"Considering what's on television these days, it would be appropriate to only have those people pay who actually (want to) follow the programming.",Nevertheless one has to point out that there'd probably be way fewer stations if it weren’t the whole of Germany that’s obliged to pay.
RA,Therefore universities should not charge tuition fees in Germany.,Every German citizen has a right to education.
CA,Proponents of the death penalty count on its deterring effect as well as the ultimate elimination of any potential threat.,However also the threat of the death penalty in the respective countries apparently cannot prevent murder and violent crime.
RA,"I find the peripheral housing development at Tempelhofer Feld right for urban planning reasons,",as the area is right in the middle of the city (capital).
RA,Tuition fees should not generally be charged by universities.,"Education and training are fundamental rights which the state, the society must provide."
RA,Tuition fees should not generally be charged by universities.,"If a university lacks the funds, sponsors must be found."
RA,I am not of the opinion that the retirement age should be set at 63 years.,The introductory phase of retirement at 63 would also be a particular challenge
CA,Supermarkets and shopping centres should be allowed to open any Sundays and holidays at their discretion.,However then you'd have a worse overview of which shop is open on a given day.
CA,We don't need it.,"If Germany were to introduce the death penalty, convicted felons could not be paroled or break out of prison and commit new felonies."
RA,"Thus Sundays should remain a day for getting together with family,",otherwise there will be a new kind of leisure activity where people spend their time in supermarkets instead of outside or in conversation etc.
CA,Higher penalties for dog dirt are pointless as long as there is not enough personnel to enforce them.,"In individual cases they may indeed act as a deterrent,"
RA,"Dog owners should pay higher fines for dog dirt left on pavements,","A higher fine, so dog owners would have to dig deeper into their pockets, is supposed to be a deterrent after all."
RA,"Considering what's on television these days, it would be appropriate to only have those people pay who actually (want to) follow the programming.",so there's no advantage for the current paying viewers of the public broadcasters.
CA,For dog dirt left on the pavement dog owners should by all means pay a bit more.,"Indeed it's not the fault of the animals,"
RA,"Capital punishment is not a solution,",as it cannot be ruled out that the judicial process may make mistakes.
RA,as they can plan for a maximum rent increase.,"That the landlords are then slightly restricted in the administration of their property is not a problem,"
RA,That's costly!,Fees result in longer durations of studies.
RA,The state ought to prevent murder - not avenge it.,'An eye for an eye' seems to miss the point.
CA,The prototype of Audi's new sports car has car lovers raving.,"The steering system may still need a bit of tweaking,"
RA,That's why there ought to be one day a week when supermarkets and shopping centres stay closed.,"But after all, the purpose of having a day off is not just to make time to go to church."
CA,"It would be an exception if you only watched quiz shows,",but you tend to watch Big Brother and X-Diaries.
CA,Video games ought to be included in the ranks of Olympic events.,"Considering their requirements, some video games are not relevant as sports,"
RA,Peter should close his snack bar as soon as possible.,and his pool of customers is shrinking constantly.
CA,When he got back from Ralf's party last night he was still stone-cold sober.,Ralf does insist that they drank advocaat together.
RA,Germany should by no means introduce capital punishment.,"What, then, ought to be done with criminals who have committed truly awful crimes such as murder or rape - should they simply be allowed to live on"
CA,you should buy IBM shares if you want to invest.,"and the mood in the stock market could be better on the whole,"
RA,"Still, the state needs the death penalty as a deterrent to horrific crimes.","Criminals should not be put in luxury prisons, though."
RA,"Plus everyone has to move approx. 3-10 times in his or her life,",because the size of the desired accommodation changes over the course of a lifetime.
RA,everyone should chip in.,The thought of television exclusively made up of private channels scares me.
RA,computer games should also not be recognized as Olympic events.,Yet sports are usually associated with physical training.
RA,"The implementation of retirement at 63 is no longer socially sustainable,","as the population in Germany has, viewed demographically, a disproportionate number of old people,"
CA,The statutory health insurance companies should also cover treatments with non-medical and alternative practitioners.,Their treatment methods and successes are not amply researched or proven.
CA,German universities should on no account charge tuition fees.,One could argue that an increase in tuition fees would allow institutions to be better equipped.
CA,"Dog owners should pay higher fines for dog dirt left on pavements,",although there aren't enough bins and bag-dispensers for dog dirt.
RA,"Yet it remains questionable whether the actual implementation of such supervision would at the same time lead to a stronger observance of laws,",as ultimately this decision is in the hands of the respective government leaders.
RA,School uniforms should not be worn in our schools.,Plus such uniforms also stand for ideological conformity and for the suppression of individual self-development.
RA,A cap on rent increases upon tenant change is therefore not to be supported.,Rent prices are already regulated in favour of tenants due to existing laws and the rent index.
RA,"This helps the landlords,",as they can plan for a maximum rent increase.
RA,"Nevertheless, everybody should contribute to the funding of the public broadcasters in equal measure,",for we need general and independent media.
CA,Rent prices should be limited by a cap when there's a change of tenant.,"and many, consistent with market principles, are prepared to pay higher rents,"
